class,text
4,broadband challenges tv viewing the number of europeans with broadband has exploded over the past 12 months  with the web eating into tv viewing habits  research suggests.  just over 54 million people are hooked up to the net via broadband  up from 34 million a year ago  according to market analysts nielsen/netratings. the total number of people online in europe has broken the 100 million mark. the popularity of the net has meant that many are turning away from tv  say analysts jupiter research. it found that a quarter of web users said they spent less time watching tv in favour of the net  the report by nielsen/netratings found that the number of people with fast internet access had risen by 60% over the past year.  the biggest jump was in italy  where it rose by 120%. britain was close behind  with broadband users almost doubling in a year. the growth has been fuelled by lower prices and a wider choice of always-on  fast-net subscription plans.  twelve months ago high speed internet users made up just over one third of the audience in europe; now they are more than 50% and we expect this number to keep growing   said gabrielle prior  nielsen/netratings analyst.  as the number of high-speed surfers grows  websites will need to adapt  update and enhance their content to retain their visitors and encourage new ones.  the total number of europeans online rose by 12% to 100 million over the past year  the report showed  with the biggest rise in france  italy  britain and germany.  the ability to browse web pages at high speed  download files such as music or films and play online games is changing what people do in their spare time.  a study by analysts jupiter research suggested that broadband was challenging television viewing habits. in homes with broadband  40% said they were spending less time watching tv. the threat to tv was greatest in countries where broadband was on the up  in particular the uk  france and spain  said the report. it said tv companies faced a major long-term threat over the next five years  with broadband predicted to grow from 19% to 37% of households by 2009.  year-on-year we are continuing to see a seismic shift in where  when and how europe s population consume media for information and entertainment and this has big implications for tv  newspaper and radio   said jupiter research analyst olivier beauvillian.
1,fears raised over ballet future fewer children in the uk are following in the dainty footsteps of dancers like darcey bussell  and carving out potential careers as ballet dancers.  new research from the royal academy of dance (rad) has found fewer children over the age of 10 are attending ballet classes and taking exams in the discipline. the organisation blames the growing popularity of computer games and other changes in lifestyle. and there are fears that if the trend is not reversed  there could be fewer british ballet stars in the future. the rad found that the number of youngsters taking their ballet exams drops by almost 70% after the age of 10 or 11. dance teacher eve trew  who has taught ballet for over 48 years  told bbc news she had seen a  vast  change over the years. she blamed modern lifestyles for the fall in ballet attendance.  i think the children of many years ago did not have as many hobbies   she said.  the trouble now is that they are wide open to computers  gameboys and everything else children have got.  as a result  there is less time being spent on ballet lessons.   hazel gilbert  23  an information manager from newcastle  gave up ballet at the age of 10 and is typical of the problem.  it s not a very cool thing to do when you go to  big  school and i think you have to be very focused on ballet to want to carry on doing it   she said.  i used to love it  but after a certain age it becomes much more disciplined and i didn t want that.  i started getting into other things  like swimming and kickboxing  and ballet just wasn t something i wanted to do any more.  ms trew  who runs a dance school in gateshead  admitted it would be  very difficult  to reverse the trend and said many young ballet dancers were no longer willing to make the sacrifices to succeed.  you have to be very dedicated and you have to be very disciplined.  it is a career that you have got to really want to do because it is such hard work.  children these days have not got the time to spend perfecting it... that is very sad.   currently  only two out of 16 principal dancers at the royal ballet - darcey bussell and jonathan cope - are british  compared to 16 of the 21 principals in 1985. but a spokesman for the english national ballet told bbc news that although only two out of their 12 principal dancers were british  around a quarter of the company s dancers were from the uk. he said competition at open auditions in london was  fierce  between talented dancers from all over the world. the rad have launched a new competition to try and reverse the decline in british ballet. dame antoinette sibley  president of the rad  launched the fonteyn nureyev young dancers competition earlier this week.  aimed at children aged 10 to 13  it is hoped the contest will help keep british ballet evolving. a spokeswoman for the rad said:  it is our responsibility to re-ignite the passion and nurture young dancers for the long-term future of ballet.  we need to provide them with a framework and a goal to work towards  with constant support and coaching in an environment where they can work with their peers and possibly leading artists and choreographers.  perhaps more importantly provide them with the opportunity to experience  performance  themselves.  what better way to reignite a passion for ballet than to let them experience the thrill of performance
3,holmes is hit by hamstring injury kelly holmes has been forced out of this weekend s european indoor athletics championships after picking up a hamstring injury during training.  the double olympic champion said:  i am very disappointed that i have been forced to withdraw.  i can hardly walk at the moment and i won t be able to do any running for two or three weeks although i ll be keeping fit as best i can.  holmes will have now have intensive treatment in south africa.  the 34-year-old made a cautious start to the season but looked back to her best when she stormed to the 1 000m title at the birmingham grand prix 10 days ago. after that race and more progress in training  holmes revealed she had decided to compete at the european indoors before her plans were wrecked last weekend.  on saturday night i pulled my hamstring running the last bend on my final 200m of the night   said holmes.  i was going really  really well when i felt a massive spasm in my left leg and my hamstring blew.  i saw the doctor here and he has said it is not serious but it s frustrating missing madrid when i knew i was in great shape.  holmes has now been advised by her coach margot jennings not to rush back into training and it is unlikely she will compete again until the summer. helen clitheroe now goes to madrid as the only british competitor in the women s 1500m while there will be no representative in the 800m.
1,uganda bans vagina monologues uganda s authorities have banned the play the vagina monologues  due to open in the capital  kampala this weekend.  the ugandan media council said the performance would not be put on as it promoted and glorified acts such as lesbianism and homosexuality. it said the production could go ahead if the organisers  expunge all the offending parts . but the organisers of the play say it raises awareness of sexual abuse against women.  the play promotes illegal  unnatural sexual acts  homosexuality and prostitution  it should be and is hereby banned   the council s ruling said.  the show  which has been a controversial sell-out around the world  explores female sexuality and strength through individual women telling their stories through monologues. some parliamentarians and church leaders are also siding with the media council  uganda s new vision newspaper reports.  the play is obscene and pornographic although it was under the guise of women s liberation   mp kefa ssempgani told parliament.  but the work s author  us playwright eve ensler  says it is all about women s empowerment.  there is obviously some fear of the vagina and saying the word vagina   ms ensler told the bbc.  it s not a slang word or dirty word it s a biological  anatomical word.  she said the play is being produced and performed by ugandan women and it is not being forced on them. the four ugandan ngos organising the play intended to raise money to campaign to stop violence against women and to raise funds for the war-torn north of the country.  i m extremely outraged at the hypocrisy   the play s organiser in uganda  sarah mukasa  told the bbc s focus on africa programme.  i m amazed that this country uganda gives the impression that it is progressive and supports women s rights and the notions of free speech; yet when women want to share their stories the government uses the apparatus of state to shut us up.
0,south african car demand surges car manufacturers with plants in south africa  including bmw  general motors  toyota and volkswagen  have seen a surge in demand during 2004.  new vehicle sales jumped 22% to 449 603 from a year earlier  the national association of automobile manufacturers of south africa (naamsa) said. strong economic growth and low interest rates have driven demand  and analysts expect the trend to continue. naamsa said it expects sales to top 500 000 in 2005. during 2004  south africa was one of the best performing markets internationally  for car sales  naamsa said. while domestic demand is set to continue to enjoy rapid growth  foreign sales could come under pressure  analysts said. the vehicle industry accounts for about 13% of south africa s total exports. however  the world auto market has its problems and analysts warn that overcapacity and the strength of the rand could hit exports.
3,jones medals  must go if guilty  world anti-doping agency (wada) chief dick pound says marion jones should be stripped of all her medals if found guilty of taking banned substances.  victor conte  of balco laboratories  claims the american sprinter regularly used drugs to enhance her performance.  if she is found guilty she should be stripped of all her medals and banned for two years   said pound. asked if there was a timescale as to what medals could be taken  pound said:  that is not an issue at all.  however  under international olympic committee (ioc) rules  athletes can only be stripped of their medals if caught within three years of the event. jones  who won five medals at the 2000 olympics  denies using drugs and says she will take legal action over conte s allegations. balco laboratories is the firm at the centre of a wide-reaching investigation into doping in the us. pound continued:  if she has indeed taken drugs it is going to be a big disappointment for a lot of people.
0,soros group warns of kazakh close the open society institute (osi)  financed by billionaire george soros  has accused kazakhstan officials of trying to close down its local office.  a demand for unpaid taxes and fines of $600 000 (£425 000) is politically motivated  the osi claimed  adding that it paid the money in october. the organisation has found itself in trouble after being accused of helping to topple georgia s former president. it denies having any role  but offices have had to close across the region.  the osi shut its office in moscow last year and has withdrawn from uzbekistan and belarus. in the ukraine earlier this year  mr soros - who took on the bank of england in the 1990s - and won  was pelted by protestors.  this legal prosecution can be considered an attempt by the government to force soros foundation-kazakhstan to cease its activities in kazakhstan and shut its doors for kazakh citizens and organisations   the osi said.  the osi aims to promote democratic and open  market-based societies. since the break up of the soviet union in 1991  kazakhstan has been dominated by its president nursultan abish-uly nazarbayev. he has powers for life  while insulting the president and officials has been made a criminal offence. the government controls the printing presses and most radio and tv transmission facilities. it operates the country s national radio and tv networks. recent elections were criticised as flawed and the opposition claimed there was widespread vote rigging. supporters  however  say he brings much needed stability to a region where islamic militancy is on the rise. they also credit him with promoting inter-ethnic accord and pushing through harsh reforms.
3,adriano s chelsea link rejected adriano s agent gilmar rinaldi has insisted that he has had no contact with chelsea over the striker.  chelsea were reported to have made inquiries about inter milan s 22-year-old brazilian star. rinaldi told bbc sport from rio de janeiro:  i can assure you that chelsea have had no dealings whatsoever with either me or adriano.  parma and real madrid are interested but there s nothing new there. their interest has been known for some time.  adriano has scored 14 goals in 20 serie a appearances this season. and chelsea boss jose mourinho had claimed that he was in milan talking to adriano on the day he is alleged to have held a clandestine meeting with arsenal defender ashley cole. mourinho said he was  just practising my portuguese with him because i don t need strikers . rinaldi told bbc sport:  i have to say that nobody from chelsea or any other london club has contacted me.  if they want to  that s fine. i can tell them what the situation is.  if chelsea are interested then they must make an offer.  inter are reported to have slapped a price tag in the region of £40m on the head of adriano  who joined them just over a year ago from parma. real madrid view him as a natural replacement for compatriot ronaldo. but rinaldi said:  i cannot give you a price that inter would accept for adriano. that s something that would have to be negotiated between the interested clubs.
4,progress on new internet domains by early 2005 the net could have two new domain names.  the .post and .travel net domains have been given preliminary approval by the net s administrative body. the names are just two of a total of 10 proposed domains that are being considered by the internet corporation for assigned names and numbers  icann. the other proposed names include a domain for pornography  asia  mobile phones  an anti-spam domain and one for the catalan language and culture.  the .post domain is backed by the universal postal union that wants to use it as the online marker for every type of postal service and to help co-ordinate the e-commerce efforts of national post offices.  the .travel domain would be used by hotels  travel firms  airlines  tourism offices and would help such organisations distinguish themselves online. it is backed by a new york-based trade group called the travel partnership. icann said its early decision on the two domains was in response to the detailed technical and commercial information the organisations behind the names had submitted. despite this initial approval  icann cautioned that there was no guarantee that the domains would actually go into service. at the same time icann is considering proposals for another eight domains. one that may not win approval is a proposal to set up a .xxx domain for pornographic websites. a similar proposal has been made many times in the past. but icann has been reluctant to approve it because of the difficulty of making pornographers sign up and use it. in 2000 icann approved seven other new domains that have had varying degrees of success. three of the new so-called top level domains were for specific industries or organisations such as .museum and .aero. others such as .info and .biz were intended to be more generic. in total there are in excess of 200 domain names and the majority of these are for nations. but domains that end in the .com suffix are by far the most numerous.
3,hewitt fights back to reach final lleyton hewitt kept his dream of an australian open title alive with a four-set win over andy roddick in friday s second semi-final.  the home favourite will face marat safin in sunday s final after coming through 3-6 7-6 (7-3) 7-6 (7-4) 6-1. hewitt fought back from a set down and trailed in both tie-breaks but would not be denied  thrilling the melbourne crowd with a typically battling effort. he is aiming to be the first australian winner since mark edmondson in 1976. hewitt is the first australian to make the final since pat cash lost to mats wilander in 1988  but faces a huge challenge against safin - the conqueror of roger federer. after needing five sets in his last two matches there was reason to think hewitt might struggle for fitness. he certainly made a sluggish start  dropping his opening service game  and roddick dominated with his huge serve as he took the first set.  after 12 tense games in the second  the key moment came when hewitt raised his game in the tie-break to overturn an early mini-break. that energised the crowd but roddick was not finished and raced 4-1 clear in the crucial third before hewitt pegged him back and forced another tie-break. again roddick broke first and again hewitt fought back  taking the lead with a superb backhand pass.  the australian was not to be denied and a disheartened roddick made little impact in the fourth set as hewitt raced to victory  sending the melbourne crowd wild and ensuring the final will be a huge occasion.  it s awesome   said hewitt.  i started preparing for this tournament nine months ago.  i ve done a lot of hard yards to get here.  i ve always said i d do anything to get in the first night final at the australian open. now i ve got my chance.  roddick was furious with himself for failing to take advantage of leads in both tie-breaks.  i m usually pretty money in those   said roddick.  either one of those would have given me a distinct advantage.  i m mad  i felt i was in there with a shot. he put himself in position to win big points. i donated a little more than i would have wanted.  and the american played down the influence of one spectator who appeared to contribute to a double fault by shouting during rodick s service action.  it just took one jackass to shout out   said roddick  adding that the crowd overall was  very respectful .
0,troubled marsh under sec scrutiny the us stock market regulator is investigating troubled insurance broker marsh & mclennan s shareholder transactions  the firm has said.  the securities and exchange commission has asked for information about transactions involving holders of 5% or more of the firm s shares. marsh has said it is co-operating fully with the sec investigation. marsh is also the focus of an inquiry the new york attorney-general into whether insurers rigged the market. since that inquiry was launched in october  marsh has replaced its chief executive and held a boardroom shake-out to meet criticism by lessening the number of company executives on the board. prosecutors allege that marsh - the world s biggest insurance broker - and other us insurance firms may have fixed bids for corporate cover. this is the issue at the heart of the inquiry by new york s top law officer  eliot spitzer  and a separate prosecution of five insurers by the state of california. the sec s investigation into so-called related party transactions includes dealings in the trident funds  managed by mmc capital  the company s private equity firm. marsh s new chief executive  michael cherkasky  is trying to negotiate a settlement with mr spitzer. mr spitzer has built up a reputation as a fierce critic and campaigner against corporate america s misdeeds.  the uncertainty unleashed by the scandal has prompted three credit rating agencies - standard & poor s  moody s and fitch - to downgrade marsh in recent weeks. according to the financial times  insurance analysts are now questioning whether marsh will be able to maintain its strong record of earning growth as they draw up forecasts for the first quarter of next year. doubts also exist over how much the company may have to pay regulators and lawyers to put the scandal behind.
3,worcester v sale (fri) sixways  friday  25 february  2000 gmt  they make just one change  with tim collier replacing phil murphy in the second row. in contrast  sale are missing 14 players due to a combination of international call-ups and injuries. john payne and chris rhys jones come into the centres while scrum-half richard wigglesworth looks set to play on the wing.  delport; pieters  rasmussen  lombard  o leary; brown  powell; windo  van niekerk  horsman; collier  gillies; hickey  sanderson  macleod- henderson.  replacements: fortey  murphy  daly  vaili  cole  hayes  trueman.  hanley; mayor  payne  rhys jones  wigglesworth; hercus  redpath (capt); turner  roddam  stewart; day  schofield; caillet  carter  chabal.  replacements (from): bozzi  coutts  anglesea  lund  martens  riley  duffy  c jones.
3,edu blasts arsenal arsenal s brazilian midfielder edu has hit out at the club for stalling over offering him a new contract.  edu s deal expires next summer and he has been linked with spanish trio real madrid  barcelona and valencia. he told bbc sport:  i m not sure if i want to stay or not because the club have let the situation go on this far.  if they had really wanted to sign they should have come up with an offer six months before indicating they wanted to sign me and that s made me think.  edu s brother and representative amadeo fensao has previously said that arsenal s current offer to the midfielder was well short of what he was seeking. and edu  26  added:  my brother is due to come to london on thursday.   there is a meeting planned for 6 or 7 january to sort it out with arsenal.  now i have a choice to stay or go. i want to sort it out as soon as possible  that s in the best interests of both the club and myself.  i m going to make my decision after the meeting later this week.  edu is now able to begin negotiations with other clubs because fifa regulations allow players to start talks six months before their contracts expire. the midfielder  who broke in to the brazilian national side in 2004  admitted he had been flattered to have been linked with the three spanish giants. edu said:  i ve just heard stories from the news that the madrid president florentino perez  the valencia people  as well as barcelona are interested.   that s nice  but i ve never talked to them  so i can t say they want me sign 100%.  last month wenger said he we was hopeful edu would sign a new deal and played down suggestions that the lure of a club like real madrid would be too strong for edu. edu added that he had been encouraged by wenger s support for him.  i still have a good relationship with arsene wenger - he s always said he wants me to sign.
2,hague  given up  his pm ambition former conservative leader william hague says he will not stand for the leadership again  having given up his ambition to be prime minister.  mr hague  43  told the daily telegraph he would now find a life dominated by politics too  boring  and unfulfilling. mr hague  who stepped down after his party s 2001 election defeat  does not rule out a return to the front bench. he also told the paper he hopes to remain mp for richmond  north yorks  and start a family with wife ffion. mr hague  who recently had published the biography of william pitt the younger  also said he wanted to continue writing books and speech-writing.  he told the newspaper:  i don t know whether i will ever go back on to the front  but don t rush me.  asked if he would stand for the leadership again  mr hague replied:  no. definitely not.  his determination to stay away from a central role will disappoint some senior conservative members  who say the party needs him. tim collins  the shadow education secretary  said last week it would be a  huge boost  to the party if mr hague returned to the front bench. mr hague became an mp at 27 and leader of the opposition at 36. he said:  i feel fortunate that  by the age of 40  i had crammed in an entire political career.  i had been in the cabinet and been leader of the party  so now i can branch out into other things...it is a very liberating feeling.  mr hague added that he may have misjudged his own ambition to be prime minister.  maybe i wasn t as driven by politics as i thought i was   he said.
