class,text
2,minimum wage increased to £5.05 the minimum wage will rise in october  benefiting more than 1m people  the government has announced.  adults must be paid at least £5.05 an hour  up from £4.85  while 18 to 21 year olds will be paid £4.25. the recommendations came from the low pay commission which said the number of jobs had continued to grow since the minimum wage was introduced in 1999. businesses wanted it frozen  warning more rises could damage competitiveness but the unions want a £6 rate.  a further increase in the adult rate to £5.35 an hour is provisionally scheduled for october 2006. according to the commission  many businesses had found the last two significant increases in the minimum wage  challenging .  we have therefore recommended only a slight increase above average earnings  and concentrated it in the second year to allow business more time to absorb the impact   said chairman adair turner. the government says most of those on the minimum wage are women - with many working in cleaning  catering  shops and hairdressing.  unveiling the latest increase  mr blair said he wanted the minimum wage to become a  symbol of decency and fairness .  for too long  poverty pay capped the aspiration and prosperity of far too many hard-working families   he said.  too often  people were told to make a choice between the indignity of unemployment or the humiliation of poverty pay.  chancellor gordon brown and transport secretary alistair darling promoted the news in edinburgh  wales secretary peter hain and welsh first minister rhodri morgan in cardiff and northern ireland minister john spellar in belfast. the government has not accepted the commission s recommendation that 21-year-olds should be paid at the adult rate  but says it will look again at the rate later on. mr brown said:  we want to do nothing that can damage the employment opportunities for young people  particularly young people entering the labour market for the first time.  the government has said it will look at tougher action against the small number of employers who consistently refuse to pay the minimum wage.  the national minimum wage is currently set at £4.85 per hour for those aged 22 and above  and at £4.10 for those aged 18 to 21. a £3 per hour minimum wage was introduced last october for 16 to 17-year-olds  but apprentices are exempt. the trade unions congress welcomed the increase  but has called for a £6 minimum wage by next year. but the confederation of british industry (cbi) called for a  pause year  to assess the impact of the above inflation rise in the minimum wage in october. and david frost  director of the british chambers of commerce  said:  the level of increase each year has increased by rates far outstripping the rates of inflation.  what employers are saying to us now is that it s at a level where it s starting to bite into the competitiveness of companies right across the country.   the liberal democrats  economics spokesman vincent cable said he supported the move to raise the minimum wage.  it s not just good for the workers themselves but it lifts them out of benefits and therefore is good for the exchequer too   he said. conservative leader michael howard said he accepted the principle of the minimum wage and would not  seek to disturb  the increase. speaking on bbc radio 4 s woman s hour  mr howard hinted the tories might go into the general election with a promise to cancel income tax for the lowest-paid workers.  there are people on very low salaries  very low incomes indeed who really shouldn t be paying income tax   he said.  it would be better to decrease taxes on earnings below £12 000 a year  with say no tax on below £6 000. the losses in tax can be recouped by having a 50pc tax band for people making over £100 000. our minimum wage is going to be effectively almost twice the us minimum wage  yet our economy per person is only 2/3rds of the us! perhaps  we have to really starting questioning why some products cost 50-60% more here than they do in the us. this combined with the tax decreases would make the pounds the low-paid people do make go much further.  it s still not good enough! i got a part time job at 16 when i was doing my a-levels in an attempt to get a little money saved for uni. this was only 2 years ago and i was getting paid £2.75 an hour  and working as hard as any of the older staff  maybe it s about time 16 - 21 year olds got a fair wage!  we must remember that the minimum wage is only part of the picture and must not rise to a level that makes employing people unattractive and encourages businesses to send work and therefore jobs abroad. still government and local councils employ staff via their contractors that pay at the minimum wage or very close to it. an easy way for the government to do as it preaches would be to insist on floor pay levels for all government workers and take tens of thousand of civil servants out of the social security system all together.  any increase is certainly welcome news. however for all those whining about the pressures of an increase in the minimum wage i would simply ask them:  would you be happy to work for less than £5.05 an hour  . thought not ... so then  don t expect others to either.  i can t believe that so many of these comments are against the minimum wage! also i personally take great offence at the insinuation that people earning minimum wage were lazy at school if everyone went to university then who would serve you in the supermarkets and clean up after you  it s about time that these hardworking people are rewarded with only what they deserve and have earned fair pay and a bit of respect wouldn t go a miss either. br /&gt;  this is good news. the minimum wage has put a sense of equality back into a worker s relationship with their employer. wages are supposed to be a fair reflection of an employee s efforts. for too long wages were a point of exploitation - what could an employer get away with. in very simplistic terms this put a pressure to keep low-paid wages low. with the minimum wage this downward pressure is at least partly removed.  it is also interesting to read the comments from so called business leaders. they are the first to defend the rights and privileges of boards to award fat-cat salaries  bonuses and pension rights to the select few but they are the first to attack policies that are put in place to merely defend the rights of those that really make those fat cats purr!  i feel there are both negatives and positives to the increase  on one hand some businesses will struggle to stay afloat but on the other hand in today world many young people can t afford to move out as property costs too much and only by earning more will they be able to get on in life. its true many may get complacent but the minimum wage could be looked at as more of a stepping stone rather than a hand out.  here come the usual whines about how difficult it will be for businesses! we all remember michael howard s protestations that the minimum wage would cost a million jobs when it was introduced - funny how he s gone quiet on that one! jobs have continued to increase since this humane legislation was brought in. i think if any job is worth doing then it s worth being paid a fair wage for  and £5.05 is hardly a fortune. if your business cannot pay its workers a decent wage then maybe it s not being run properly and if it folds  a better-run company will take over its duties and employ more people  so everybody wins except incompetent business owners!  great keep at it tony  i remember the despair of the 80s and the low wages employers got away with. at last we can make a difference to people and reward them for working. we can t afford not to pay a decent wage. it s not a jobs at any price economy  goodbye sweatshops hello decency.  the increase in minimum wage is a good thing. living in the southwest where house prices and rent have increased hugely (like the rest of the country) over the past 5 years has made living for you average 18-21 years old very difficult. in the south west the increase in living costs have not been matched by an increase in pay  for example a job i did in plymouth was underpaid to an equivalent worker in exeter by 75p an hour. hopefully the increase in the minimum wage will bring in to balance pay on a regional and national level  and in turn allow people like myself who do work hard  but might never earn a 6 figure salary the chance to branch out on our own.  i work at a large hospital where the contractors providing all ancillary services - domestic  catering & portering etc - pay the minimum wage of £4.85 as the basic rate. someone has to do these unglamorous jobs and earn enough to live decently. how dare people suggest we are lazy or complacent for accepting these jobs and these wages  who do they think will be carrying out these public service jobs if contractors are allowed to pay as little as their consciences allow   this is definitely the right step in the right direction. it shows that this government cares for the low income earners as well. this is a million votes more. good strategy isn t it   although i would not deny people the minimum wage increase  its timing stinks. i am quite prepared for a raft of  bribes  to come from the government before the election and a raft of taxes afterwards  they are playing us for the fools they think we are.  this is extremely bad news for any business - whether they are small and medium enterprises or even large companies. by increasing overheads  for business  there will be an almost certain rise in costs to the consumer who while they openly welcome the idea of an increase in the minimum wage are the same people who still want to buy that shirt  or that pair of trainers for next to nothing. the extra cost this increase will bring  will only be reflected in the price of the goods we buy  which  in turn will only serve to discourage companies from setting-up business in the uk  or encourage those companies already based here to look elsewhere. the jubilation felt by  low-paid  workers here will soon give way to misery as they lose their jobs.  this will only lead to a reduction in jobs. why have many of the call centre jobs gone to india. blair say s the economy is  strong and stable economy  however consumer debt and the country s debt is at its highest and now they heap this onto businesses  that will have no choice but to cut the workforce.  the timing cannot be coincidental. this is blatant electioneering and should be exposed as such.  andrew in derby complains that raising the minimum wage is  blatant electioneering . i don t mind if it is. in our degraded democracy  elections are the one time when elites really have to worry about doing something concrete for the majority. my only complaint is the paltry figures being discussed. if my maths is right  a 35 hour week at £5.05 gives you an annual income just over £9 000 and raising it to £6 leaves it under £11 000. the unions should be putting the government under pressure for much more. businesses complaining might like to take a look at corporate pay  shareholder payouts and profits before wondering if paying a living wage is really a controlling factor in the viability of their firm.  i am all for lifting the minimum wage of workers to a reasonable level  but we have to accept that with this will come competition from overseas workers. also small businesses will have to be able to afford this manpower cost. we are already seeing a sweeping change in it work being lost to india where people are paid much less. it is difficult for me to understand that only five years ago cheap labour abroad was classified as  sweat shop   but now we are told it is global competition. with our manufacturing industry in serious decline the country cannot be entirely service industries without something tangible to serve. there has to be something at the top of the food chain and that is manufacturing. the whole picture needs to be looked at.  this is great news  but that might be because i work for minimum wage. seems a good idea and will hopefully be an incentive to those who live to claim to actually get a job. when you can  earn  more from claiming than you can from work  there is no incentive. perhaps a step in the right direction.  if the tuc get their way a very large number of smes will have to close - this will put more people out of work. how then will the government fudge the unemployment figures! the government know it is not big business that keeps the economy going but the smes but we always get overlooked  they will only take notice if these large corporations close and move to other countries  after all they are predominantly owned by foreign companies. we are a specialist company but with these increases have already had an effect on us and we have lost work another one will close us.  while i m delighted for those on low pay that this increase is being put forward  i am extremely concerned at the implications for small businesses. as an employee for a small nursery  i know this increase will cause great hardship for my employer  who has been unable to increase salaries for higher paid employees because of last october s increase for the lower paid employees - who were originally being paid slightly above the minimum but are now on the minimum. this latest increase of 20p an hour will cause even more financial hardship. if the rate rises to £6 then i can foresee many small businesses having to pay off employees.  the increase in minimum wage will have a serious effect on my business. although we pay above the minimum level we will have to increase our pay rates to maintain the differential. the raise is well above inflation and without significant increases in sales  it will mean that i will not be taking on a new member of staff as planned and i will be looking to reduce the total hours worked by the other members of staff  overtime being the first to go.  i currently employ 42 staff whose wages mirror the national minimum wage. increases above inflation are fine but all of my business is conducted with local authorities who will not accept above inflation rises in my service delivery. 80% of my costs are labour. the other aspect that is always hidden is that the thresholds for tax credits do not move in line with these increases so that all that happens is that employees tax credit support is reduced by the amount of the increase  thereby saving the government money but increasing the financial burden on small to medium businesses  it is very good that the government has decided to increase the minimum wage - this should hopefully motivate people to undertake the  lower status  jobs.  i know about this great idea - don t bother getting qualifications  laze about at school  no need to do anything other than attend so your parents don t get fined because remember  when you do eventually start working  doesn t matter how lazy you are  you ll be guaranteed a decent wage. the ones who suffer are the employers.  i hope that if industry and business have to pay this new rate that mr blair and mr brown will increase tax allowances and raise national insurance thresholds so that the treasury won t take some of this increase off the people they say they are helping  or is this just another form of stealth tax on business through the back door   i don t believe in the minimum wage at all! i think jobs should create their own wage value and that if people want higher wages they should earn them. now  before everyone thinks that i am some  rich-kid   i can assure you i am not. i came from a very much working class background and started work 20 years ago on a youth opportunity program earning £25 per week. i worked hard  went to college part time  got my a-levels and degree & bettered myself. i now earn a 6 figure salary. i did that through hard work and getting off my backside. a minimum wage just makes people complacent.  to ashley  of swindon: when you earned £25 per week  it was worth something. these days that £25 would need to be near to £60 to have the equivalent buying power. i might add  that thanks to successive governments holding down the tax allowance threshold below inflation  people earning the minimum wage are paying taxes that they never would have done 10 years ago at equivalent wages.  in my day  type arguments are a view that belong in the  your day  - 20 years ago!  as a graduate working for minimum wage  i welcome any increase of pay i can get. i disagree with ashley  swindon saying i have to work harder to get more pay. i have my gcse s a-levels and a degree and have chosen to work for a small business that can t afford the wages i should be getting  i should be on at least 3x what i m getting but they can t afford it. we all work hard but the money is just not there. but on the plus side i love my job and wouldn t change it just to get more pay.  as an employer of staff in several shops the last rise in the minimum wage cost my company an additional £5000 per year. these next rises will cost me more. i have to get the money from somewhere so pass it on to customers. so no one really wins in the end.  in answer to emma from sleaford regarding no one really wins in the end... on the contrary mr blair wins - he wins because he obviously has announced this to be a vote winner and his treasury wins because as an employer you will know that the amount of tax and national insurance that the government will receive from all the minimum wage increases will rise and of course not only will be paying out higher wages but as an employer higher employer ni contributions as well. if the minimum wage increases again and if it hits anywhere near the £6.00 mark there will be 12 more people on the employment line and one more small business going bankrupt - namely mine. think of us employers as well mr blair  we are not all big corporations earning millions.  all workers should be entitled to a fair day s pay for a fair day s work. how many people on the minimum wage have any hope of obtaining a mortgage or saving towards retirement   it is good news for many asians living in uk. students who do odd jobs can increase their income and can help there family in their home country. i thank mr. blair and his government for increase in the national minimum wage.
0,cairn energy in indian gas find shares in cairn energy rose 3.8% to 1 088 pence on tuesday after the uk firm announced a fresh gas discovery in northern india.  the firm  which last year made a number of other new finds in the rajasthan area  said the latest discovery could lead to large gas volumes. however  chief executive bill gammell cautioned that additional evalution was first needed at the site. cairn has also been granted approval to extend its rajasthan exploration area. this approval has come from the indian government.  a spokesman said the company s decision to carry out further investigations at the new find showed that it believed there was significant gas. but he added:  it s still too early to say what the extent of it is.  cairn s string of finds in rajasthan last year saw it elevated to the ftse 100 index of the uk s leading listed companies. the company had bought the rights to explore in the area from oil giant shell. mr gammell is a former scottish international rugby player.
4,slimmer playstation triple sales sony playstation 2 s slimmer shape has proved popular with uk gamers  with 50 000 sold in its first week on sale.  sales have tripled since launch  outstripping microsoft s xbox  said market analysts chart-track. the numbers were also boosted by the release of the ps2-only game grand theft auto: san andreas. the title broke the uk sales record for video games in its first weekend of release. latest figures suggest it has sold more than 677 000 copies.   it is obviously very  very encouraging for sony because microsoft briefly outsold them last week   john houlihan  editor of computerandvideogames.com told bbc news.  and with halo 2 [for xbox] out next week  it really is a head-to-head contest between them and xbox.   although xbox sales over the last week also climbed  ps2 sales were more than double that. the figures mean sony is reaching the seven million barrier for uk sales of the console. edinburgh-based developer  rockstar  which is behind the gta titles  has seen san andreas pull in an estimated £24m in gross revenues over the weekend. in comparison  blockbuster films like harry potter and the prisoner of azkaban took £11.5m in its first three days at the uk box office. the lord of the rings: the return of the king took nearly £10m over its opening weekend  although games titles are four to five times more expensive than cinema tickets.  gangster-themed gta san andreas is the sequel to grand theft auto vice city which previously held the record for the fastest-selling video game ever. the xbox game halo 2  released on 11 november in the uk  is also widely tipped to be one of the best-selling games of the year. the original title won universal acclaim in 2001  and sold more than four million copies.  mr houlihan added that sony had done well with the ps2  but it definitely helped that the release of san andreas coincided with the slimline ps2 hitting the shelves. the run-up to christmas is a huge battlefield for games consoles and titles. microsoft s xbox had been winning the race up until last week in sales. the sales figures also suggest that it may be a largely adult audience driving demand  since gta san andreas has an 18 certificate. sony and microsoft have both reduced console prices recently and are preparing the way for the launches of their next generation consoles in 2005.  both have hit crucial price points at around £100 and that really does open up new consoles to new audience  plus the release of two really important games in terms of development are also driving those sales   said mr houlihan.
1,horror film heads us box office a low-budget horror film produced by evil dead director sam raimi has topped the north american box office.  boogeyman  which focuses on a man who returns to his childhood home to confront his traumatic past  took $19.5m (£14.9m) in three days. last week s chart-topper  the robert de niro thriller hide and seek  fell to number four. other new entries included the wedding date  a comedy starring will and grace s debra messing  at number two.  the road-trip comedy are we there yet  and multiple oscar nominee million dollar baby completed the top five. other oscar contenders  including the aviator and sideways  continued to perform strongly at the box office. the aviator has taken $75m (£40m) so far  while sideways has taken $46.8m (£24.8m) in a more limited release.  boogeyman  which cost just $7m (£3.5m) to make  performed well even though it was not screened to critics before release - normally a sign that a film will get bad reviews or perform poorly at the box office.  i certainly believe it s a genre where people are going to be more moved by the marketing materials for the movie than by what the critics say   said rory bruer  head of distribution for sony pictures  which released the film in the us. overall the weekend box office was strong despite the fact that it was american football s super bowl weekend - a time when cinema admissions generally fall. this year  the top 12 films grossed around $91m (£48.3m)  compared to 2004 s super bowl weekend when the total box office was $73.4m (£38.9m).
1,christmas song formula  unveiled a formula for the ultimate christmas single has been revealed by chart bible british hit singles and albums.  the recipe includes a reference to father christmas  sleigh bells  a children s choir and a charity element. the song should also include christmas in the title  wishes for peace on earth and lots of airplay at office parties.  there are common musical elements linking nearly all the big christmas number ones of recent times   said editor david roberts. the book s analysts commissioned chart prank group moped to create the first christmas single using the whole formula - the song is called gonna have a no 1 this christmas by moped vs santa.   everybody says that christmas number ones are formulaic  but gonna have a number one this christmas is the first song to crack the formula and combine all these elements into one ultimate christmas track  said mr roberts.  surprisingly  there s no santa listed among the 8 000  top 75 chart performers in the book  so this is our chance to help santa to his rightful place in british recording history.  big festive hits over the years include band aid s do they know it s christmas   slade s merry christmas everybody  wham s last christmas and sir cliff richards  mistletoe and wine. band aid 20 s remake of do they know it s christmas is set to be confirmed as number one in the charts on sunday.
0,saudi investor picks up the savoy london s famous savoy hotel has been sold to a group combining saudi billionaire investor prince alwaleed bin talal and a unit of hbos bank.  financial details of the deal  which includes the nearby simpson s in the strand restaurant  were not disclosed. the seller - irish-based property firm quinlan private - bought the savoy along with the berkeley  claridge s and the connaught for £750m last year. prince alwaleed s hotel investments include the luxury george v in paris. he also has substantial stakes in fairmont hotels & resorts  which will manage the savoy and simpson s in the strand  and four seasons. fairmont said it planned to invest $48m (£26m) in renovating parts of the savoy including the river room and suites with views over the river thames. work was expected to be completed by summer 2006  fairmont said.
