class,text
2,kilroy-silk attacked with slurry euro mp robert kilroy-silk has had a bucket of farm slurry thrown over him by a protester in manchester.  the uk independence party member was arriving for a bbc radio show when the attacker emerged from behind a bush. fellow guest ruth kelly mp was also hit by the slurry. mr kilroy-silk said the man  who later disappeared  claimed he was  doing it in the name of islam . in january  mr kilroy-silk quit his bbc one show for remarks he made about arabs  who he called  suicide bombers .  mr kilroy-silk had already been taken off air by bbc bosses for the comments  in which he also described arabs as  limb-amputators  women repressors . the remarks prompted outrage among muslim groups. the slurry attack took place on friday as mr kilroy-silk and ms kelly  a cabinet office minister and bolton west mp  arrived at manchester high school for girls for the recording of bbc radio 4 s any questions.  the police were called but the attacker had disappeared by the time officers arrived. they are treating the incident as assault. the programme s host  jonathan dimbleby  later told the audience the mep had been covered from  head to toe . mr kilroy-silk was still able appear to appear on the show after being loaned a change of clothes.  he told reporters he was  very angry  and planned to press charges if his attacker was caught. he said the man shouted:  you ve offended my religion  i m doing this in the name of islam.   as i started to turn round a guy tipped a bucket of farmyard muck over me and then threw the rest of it over me and the car   mr kilroy-silk said.  i was totally covered  it was all through my clothes  and it stank to high heaven. it went all inside the car and splattered ruth kelly.  a bbc spokesman said:  he took his seat as jonathan dimbleby was introducing the show. fortunately someone at the school had a change of clothes to let him have.  greater manchester police said people near mr kilroy-silk had also been hit by the waste. officers took statements at the scene  but no arrests have been made. police say the suspect ran off after towards wilmslow road after committing the offence but is believed to have been driving a red vauxhall corsa earlier. the suspect is described as white  aged 30 to 40  with a ginger beard. police want to hear from anyone who has any information.  mr kilroy-silk  an mep for the east midlands  resigned the uk independence party whip in the european parliament in october  after criticising ukip and stating his ambition to be leader. however  he remains a member of the party. he said on friday he hoped to be elected party leader before christmas.  i think that is sufficient time for us to put in process what is necessary... in time for us to fight and have a significant impact upon the general election.  but a ukip spokesman said that would be impossible under the party s constitution  which requires 70 days before any leadership ballot can take place.
3,bristol city 2-1 milton keynes leroy lita took his goal tally to 13 for the season as his double earned city an ldv vans trophy win.  the striker finished off scott murray cross from close range just seconds before half-time. lita then made it 2-0 on 52 minutes  but dons  substitute serge makofo then netted a great volley to make it 2-1. the visitors almost took the tie to extra time with a late 30-yard bullet from richard johnson which was well held by steve phillips.  phillips  amankwaah  coles  hill  fortune  murray (anyinsah 59)  doherty (harley 45)  dinning  bell  lita (cotterill 72)  gillespie. subs not used: orr  brown.  hill.  lita 45  52.  bevan  oyedele  ntimban-zeh  crooks  puncheon  kamara (makofo 64)  chorley  herve (mckoy 45)  tapp (johnson 45)  mackie  pacquette. subs not used: martin  palmer.  pacquette  chorley  johnson  mckoy.  makofo 66.  3 367  j ross (essex).
1,tarantino to direct csi episode film director quentin tarantino is to direct an episode of us television series csi: crime scene investigation.  the oscar-winning pulp fiction director has also written an original story for the season finale episode. csi s co-producer  carol mendelsohn  said the episode would have  more bugs and blood  than usual. it is not tarantino s first venture into tv. in 1995 he directed an episode of the medical drama er and has also appeared in alias.  ms mendelsohn said the production team had been trying for a while to get tarantino to direct an episode of csi  and added that he was a fan of the forensic drama. she said he finally agreed a few weeks ago while csi was doing some location shooting in las vegas and the show s stars persuaded him.  he knows everything there is to know about csi  and he is into the whole mythology of csi   mendelsohn said.  quentin came in a couple of weeks ago. we had a story meeting with the writers.  he had a great idea  and it was so much fun to have him in the room... we are positively giddy.  filming is due to start in early april and the tarantino-directed episode will be broadcast in the us on 19 may.
4,us peer-to-peer pirates convicted the first convictions for piracy over peer-to-peer networks have been handed down in the us.  new yorker william trowbridge and texan michael chicoine have pleaded guilty to charges that they infringed copyright by illegally sharing music  movies and software. the two men faced charges following raids in august on suspected pirates by the fbi. the pair face jail terms of up to five years and a $250 000 (£130 000) fine.  in a statement the us department of justice said the two men operated the central hubs in a piracy community organised across the direct connect peer-to-peer network. the piracy group called itself the underground network and membership of it demanded that users share between one and 100 gigabytes of files. direct connect allows users to set themselves up as central servers that act as co-ordinating spots for sharers. users would swap files  such as films and music  by exchanging data over the network. during its investigation fbi agents reportedly downloaded 84 movies  40 software programs  13 games and 178  sound recordings  from the five hubs that made up the larger piracy group. the raids were organised under the umbrella of operation digital gridlock which was aimed at fighting  criminal copyright theft on peer-to-peer networks . in total  six raids were carried out in august. five were on the homes of suspected copyright thieves and one on a net service firm. the department of justice said that both men pleaded guilty to one count of conspiracy to commit felony copyright infringement. they also pleaded guilty to acting for commercial advantage. the two men are due to be sentenced on 29 april.
1,oscar host rock to keep it clean oscar host chris rock said he will steer clear of bad language when he fronts the awards on 27 february.  the comedian  who recently got into trouble for poking fun at the ceremony  is renowned for his heavy use of expletives during his stand-up routine. the live ceremony will be broadcast with a transmission delay on us network abc to ensure swear words are removed.  i ve been on tv and been funny not cursing   he said during an interview for cbs network s 60 minutes show.  as far as content is concerned  i will talk about the movies. i m not really worried about it. i m sure abc might be more worried about it than me   he added.  the 40-year-old comedian caused a furore when he said in an interview with us magazine entertainment weekly recently that he hardly ever watched the oscars and labelled awards ceremonies  idiotic . the show s producers defended rock and confirmed that he would still be presenting the oscar ceremony  saying his comments were  humorous digs . meanwhile  the academy has announced that oscar-nominated actress natalie portman will present an award at the ceremony. portman  who has been nominated for a best supporting actress gong for her role in mike nichols  closer  joins a growing list of stars set to bestow an award at the ceremony including dustin hoffman  drew barrymore  renee zellweger and british-born actress kate winslet.
1,lopez misses uk charity premiere jennifer lopez cancelled an appearance at the uk charity premiere of her new movie saying she was too ill to fly.  the actress and singer dropped out at the last minute and has now cancelled all european promotion of the film shall we dance  and her new album. she said:  i very much wanted to be in london but unfortunately i m not well. at the advice of my doctors i m unable to travel.  co-star richard gere attended the event held in aid of the tsunami appeal. thousands braved the cold weather to see the stars in london s leicester square. the red carpet boasted waltzing dancers in honour of the film s ballroom dancing theme. the film s director peter chelsom said he was disappointed that lopez did not attend.   it s a shame. i know it s true that she s not well because she has also cancelled her promotional tour. i ve heard she has swollen glands.  gere  55  greeted the crowd and signed autographs  accompanied by his wife carey lowell. other stars who turned out on the night included honor blackman  strictly come dancing presenter tess daly and actress anita dobson. lopez issues a statement apologising for her absence.  i m so proud of shall we dance and was looking forward to visiting london   she said.  this film was a labour of love for me  and i want to thank everyone involved in bringing it to you  from the cast  to the film director  to the crew.  lopez appeared at the grammy awards on sunday  singing a duet with her third husband marc anthony.
0,borussia dortmund near bust german football club and former european champion borussia dortmund has warned it will go bankrupt if rescue talks with creditors fail.  the company s shares tumbled after it said it has  entered a life-threatening profitability and financial situation . borussia dortmund has posted record losses and missed rent payments on its westfallen stadium. chief executive gerd niebaum stepped down last week and creditors are now pushing for greater control. shares in borussia dortmund  germany s only stock-market listed football club  dropped by almost 23% to 2.05 euros during early afternoon trading.  fund manager florian hamm - borussia dortmund s largest investor - said he would only invest more money in the company if he got a greater say in how it is run.  i demand better transparency   he is quoted as saying by germany s manger magazin. the club has also faced calls to appoint executives from outside the club.  borussia dortmund posted a record loss of 68m euros ($89m; £47m) in the 12 months through june. it made a loss of 27.2m euros in the first half of the current fiscal year and said that total debts will increase to 134.7m euros by the middle of 2006 unless a restructuring plan is pushed through.  this is the bill for their mismanagement over the past years   said hvb analyst peter-thilo halser. the club appointed an auditor  who has recommended a number of steps  including deferring the rent due on the stadium and suspending debt repayments until at least the 2006-2007 fiscal year. stephen schechter  a uk investment banker who has held talks with borussia dortmund over a possible bond sale  said the club needs a capital injection of 35m euros.  they need strong people on the board who do not have a history with the club   he said.
2,jowell confirms casino climbdown tessa jowell has announced plans to limit the number of new casinos in the uk to 24  in a move branded a  humiliating retreat  by the tories.  it puts an end to plans for up to 40 super casinos  originally outlined in the government s gambling bill. instead there will be a cap of eight new casinos in each size category - small  medium and large. the culture secretary said the move showed she listened to critics who feared an explosion in gambling.  but conservative shadow culture secretary john whittingdale said the way the government had handled the bill was a  shambles .  this announcement is a further humiliating retreat by the government.  instead of the initial intention of the gambling bill  to liberalise the rules governing gambling  the bill now imposes a more restrictive regime than exists at present.  shares in british casino operators london clubs international  rank group and stanley leisure  who had been hoping the bill would pave the way for a big expansion in smaller casinos  fell by between 10 and 25% following the announcement. ms jowell s deputy  richard caborn  said the government had adopted a cautious approach to the issue  and responded to the concerns raised.  limiting the number of regional casinos to eight in the first phase is a cautious move that will allow us to test the impact of a new kind of casino on the levels of problem gambling   he said.  we also believe it s right to apply this same level of caution to small and large casinos.   he added that local authorities would still be able to stop new casinos coming to their areas. church groups welcomed the limit on the number of casinos. salvation army spokesman jonathan lomax said:  the proliferation of these casinos on high streets across the country was a real concern and the [three year] trial period  which we think should last at least five years  will enable research into the potentially severe social consequences of an increase in hard and addictive forms of gambling.  but british british casino association chairman penny cobham said her members were  outraged  by the decision  which followed a campaign in the daily mail newspaper.  there was never going to be a massive explosion of casinos. talk of a casino on every high street was just a scaring tactic.
4,net regulation  still possible  the blurring of boundaries between tv and the internet raises questions of regulation  watchdog ofcom has said.  content on tv and the internet is set to move closer this year as tv-quality video online becomes a norm. at a debate in westminster  the net industry considered the options. lord currie  chairman of super-regulator ofcom  told the panel that protecting audiences would always have to be a primary concern for the watchdog. despite having no remit for the regulation of net content  disquiet has increased among internet service providers as speeches made by ofcom in recent months hinted that regulation might be an option. at the debate  organised by the internet service providers  association (ispa)  lord currie did not rule out the possibility of regulation.   the challenge will arise when boundaries between tv and the internet truly blur and then there is a balance to be struck between protecting consumers and allowing them to assess the risks themselves   he said. adopting the rules that currently exist to regulate tv content or self-regulation  which is currently the practice of the net industry  will be up for discussion.  some studies suggest that as many as eight million households in the uk could have adopted broadband by the end of 2005  and the technology opens the door to tv content delivered over the net. more and more internet service providers and media companies are streaming video content on the web. bt has already set up an entertainment division to create and distribute content that could come from sources such as bskyb  itv and the bbc. head of the division  andrew burke  spoke about the possibility of creating content for all platforms.  how risque can i be in this new age  with celebrity chefs serving up more expletives than hot dinners  surely i can push it to the limit   he said.  in fact  he said  if content has been requested by consumers and they have gone to lengths to download it  then maybe it should be entirely regulation free. internet service providers have long claimed no responsibility for the content they carry on their servers since the law commission dubbed them  mere conduits  back in 2002. this defence does not apply if they have actual knowledge of illegal content and have failed to remove it. the level of responsibility they have has been tested in several high-profile legal cases. richard ayers  portal director at tiscali  said there was little point trying to regulate the internet because it would be impossible. huge changes are afoot in 2005  he predicted  as companies such as the bbc offer tv content over the net. the bbc s planned interactive media player which will give surfers the chance to download programmes such as eastenders and top gear will make net tv mainstream and raise a whole new set of questions  he said.  one of these will be about the vast sums of money involved in maintaining the network to supply such a huge quantity of data and could herald a new digital licence fee  said mr ayers. as inappropriate net content  most obviously pornography viewed by children  continues to dominate the headlines  internet regulation remains a political issue said mp richard allan  liberal democrat spokesman on it. mr allan thinks that the answer could lie somewhere between the cries of  impossible to regulate  and  just apply offline laws online . in fact  instead of seeing regulation brought online  the future could bring an end to regulation as we know it for all tv content. after lord currie departed  the panel agreed that this could be a reality and that for the internet people power is likely to reign.  if content is on-demand  consumers have pulled it up rather than had pushed to them  then it is the consumers  choice to watch it. there is no watershed on the net   said mr burke.
4,seamen sail into biometric future the luxury cruise liner crystal harmony  currently in the gulf of mexico  is the unlikely setting for tests of biometric technology.  as holidaymakers enjoy balmy breezes  their ship s crew is testing prototype versions of the world s first internationally issued biometric id cards  the seafarer s equivalent of a passport. along with the owner s picture  name and personal details  the new seafarers  identity document incorporates a barcode representing unique features of its holder s fingerprints. the cards are due to be issued in february next year  in line with the revised un convention on seafarers  identity documents of june 2003. tests currently under way in the caribbean are designed to ensure that new cards and their machine readers  produced by different companies in different countries  are working to interoperable standards. results of the current tests  which involve seafarers from a wide range of occupations and nationalities  will be published by the international labour organisation (ilo) by the end of november. crystal cruises  which operates the crystal harmony  is exploring the use of biometrics but has not yet committed to the technology.  authenti-corp  the us technology consultancy  has been working with the ilo on its technical specifications for the cards.   if you re issued a seafarer s id in your country  you want to be sure that when the ship lands in a port in  say  my country you can validate yourself using whatever equipment we have installed   authenti-corp s ceo  cynthia musselman  told the bbc s go digital programme. she said french  jordanian and nigerian nationals would be the first seafarers to get the new id cards since their countries have already ratified the convention. it aims to combat international terrorism whilst guaranteeing the welfare the one million seafarers estimated to be at sea. the convention highlights the importance of access to shore facilities and shore leave as vital elements to a sailor s wellbeing and  therefore  it says  to safer shipping and cleaner oceans.  by increasing security on the seas as well as border control and protection  the cards will hopefully reduce the number of piracy problems around the world   said ms musselman.  it should be a safer environment for seafarers to work in  and will allow people protecting their borders to have confidence that the people getting off the ship are  in fact  seafarers.
2,hunt ban support is  in decline  support for a ban on hunting has fallen in the past six years  a poll suggests.  less than half the uk wants a ban compared to almost two-thirds in 1999  the mori survey of 2 000 adults for bbc one s countryfile programme suggests. the number opposed to a ban remains constant  but those  neither supporting nor opposing  has increased by 11%. most city-dwellers support the ban but rural people were evenly split between supporters  opponents and undecided.  polling company mori carried out both surveys. in july 1999 they asked 801 adults if they supported the ban for the mail on sunday. for countryfile they asked 2 234 adults across the country the same question. the mail on sunday survey found that 63% supported a hunting ban compared with 24% against. in the countryfile survey  47% said they supported the legislation  with 26% against. but the programme makers suggest the british public are becoming  increasingly neutral  to the issue because around one quarter said they  neither support nor oppose  a ban.
2,tory expert denies defeat warning the conservatives  campaign director has denied a report claiming he warned michael howard the party could not win the next general election.  the times on monday said australian lynton crosby told the party leader to focus on trying to increase the tories  commons presence by 25 to 30 seats. but mr crosby said in a statement:  i have never had any such conversation... and i do not hold that view.  mr howard later added there was not  one iota  of truth in the report. the strategist helped australia s pm  john howard  win four elections. mr howard appointed mr crosby as his elections chief last october. mr crosby s statement said:  the conservative party has been making an impact on the issues of lower tax and controlled immigration over the past week.  it added:  the labour party will be wanting to do all they can to distract attention away from the issues that really matter to people.
4,eu software patent law faces axe the european parliament has thrown out a bill that would have allowed software to be patented.  politicians unanimously rejected the bill and now it must go through another round of consultation if it is to have a chance of becoming law. during consultation the software patents bill could be substantially re-drafted or even scrapped. the bill was backed by some hi-tech firms  saying they needed protections it offered to make research worthwhile.  hugo lueders  european director for public policy at comptia  an umbrella organization for technology companies  said only when intellectual property was adequately protected would european inventors prosper. he said the benefits of the bill had been obscured by special interest groups which muddied debate over the rights and wrongs of software patents. other proponents of the bill said it was a good compromise that avoided the excesses of the american system which allows the patenting of business practices as well as software. but opponents of the bill said that it could stifle innovation  be abused by firms keen to protect existing monopolies and could hamper the growth of the open source movement. the proposed law had a troubled passage through the european parliament. its progress was delayed twice when polish meps rejected plans to adopt it. also earlier this month the influential european legal affairs committee (juri) said the law should be re-drafted after it failed to win the support of meps. to become law both the european parliament and a qualified majority of eu states have to approve of the draft wording of the bill. the latest rejection means that now the bill on computer inventions must go back to the eu for re-consideration.
3,leeds v saracens (fri) headingley  friday  25 february  2000 gmt  the tykes have brought in newcastle prop ed kalman and tom mcgee from the borders on loan while fly-half craig mcmullen has joined from narbonne. raphael ibanez is named at hooker for saracens in one of four changes. simon raiwalui and ben russell are also selected in the pack while kevin sorrell comes in at outside centre.  - friday s game at headingley got the go-ahead on friday after passing an early pitch inspection. leeds: balshaw; rees  christophers  bell  doherty; mcmullen  dickens; mcgee  rawlinson  gerber; murphy  palmer (capt)  morgan  parks  popham. replacements: kalman  regan  hyde  rigney  mcmillan  rock  vickerman. saracens: bartholomeusz; castaignede  sorrell  harris  vaikona; jackson  bracken; yates  ibanez  visagie; raiwalui  fullarton; randell  russell  vyvyan (capt). replacements: cairns  lloyd  broster  chesney  johnston  rauluni  little.
